{
  "$schema": "./schemas/marketplace.schema.json",
  "name": "vector-memory-mcp",
  "repository": "https://github.com/aeriondyseti/vector-memory-mcp",
  "owner": {
    "name": "AerionDyseti",
    "email": "inblessedsilencewaiting@gmail.com"
  },
  "metadata": {
    "description": "Vector memory MCP server and Claude Code plugin",
    "version": "3.0.0-dev.1"
  },
  "plugins": [
    {
      "name": "vector-memory",
      "source": "./",
      "description": "RAG-powered session memory with waypoints for Claude Code",
      "version": "3.0.0-dev.1",
      "author": {
        "name": "AerionDyseti"
      },
      "strict": false,
      "category": "productivity",
      "tags": [
        "memory",
        "rag",
        "waypoints",
        "session-persistence",
        "vector-search"
      ]
    }
  ]
}
